{
  "dataset": "AIO CODE Claim Ledger",
  "version": "2.2",
  "updated": "2026-09-27",
  "purpose": "Track canonical and research claims by entity, claim type, lifecycle state, evidence state, source, date and verification scope.",
  "claim_type_values": [
    "canonical_definition",
    "research_observation",
    "research_finding",
    "hypothesis",
    "commercial_statement",
    "operational_rule"
  ],
  "claim_status_values": [
    "draft",
    "active",
    "superseded",
    "withdrawn"
  ],
  "evidence_state_values": [
    "unknown",
    "hypothesized",
    "observed",
    "corroborated",
    "verified"
  ],
  "claims": [
    {
      "claim_id": "CLAIM-001",
      "entity_id": "MC-001",
      "claim_type": "canonical_definition",
      "claim": "The canonical public name is Marii Cuadros.",
      "source": "AIO CODE Entity Master Record",
      "source_ref": "ENTITY-MASTER-RECORD.md",
      "evidence_refs": [
        "entity/ENTITY-PASSPORT-MARII-CUADROS.md"
      ],
      "date": "2026-09-03",
      "claim_status": "active",
      "evidence_state": "observed",
      "verification_rule_id": null,
      "verification_scope": "Canonical first-party entity registry definition; not independent public recognition."
    },
    {
      "claim_id": "CLAIM-002",
      "entity_id": "AIO-001",
      "claim_type": "canonical_definition",
      "claim": "The canonical project name is AIO CODE.",
      "source": "AIO CODE Entity Master Record",
      "source_ref": "ENTITY-MASTER-RECORD.md",
      "evidence_refs": [
        "entity/ENTITY-PASSPORT-AIO-CODE.md"
      ],
      "date": "2026-09-03",
      "claim_status": "superseded",
      "evidence_state": "observed",
      "verification_rule_id": null,
      "verification_scope": "Canonical first-party entity registry definition."
    },
    {
      "claim_id": "CLAIM-003",
      "entity_id": "MC-001",
      "claim_type": "canonical_definition",
      "claim": "Marii Cuadros is the creator of AIO CODE.",
      "source": "AIO CODE Entity Master Record",
      "source_ref": "ENTITY-MASTER-RECORD.md",
      "evidence_refs": [
        "entity/ENTITY-PASSPORT-MARII-CUADROS.md",
        "entity/ENTITY-PASSPORT-AIO-CODE.md",
        "entity-graph.json"
      ],
      "date": "2026-09-03",
      "claim_status": "active",
      "evidence_state": "observed",
      "verification_rule_id": null,
      "verification_scope": "First-party authorship/creator claim recorded by the project; independent corroboration is tracked separately."
    },
    {
      "claim_id": "CLAIM-004",
      "entity_id": "NUX-001",
      "claim_type": "canonical_definition",
      "claim": "NUX is a distinct digital creative entity developed in association with Marii Cuadros.",
      "source": "NUX Entity Passport",
      "source_ref": "entity/ENTITY-PASSPORT-NUX.md",
      "evidence_refs": [
        "entity-graph.json",
        "entity/content/NUX-001/content-registry.json"
      ],
      "date": "2026-09-03",
      "claim_status": "active",
      "evidence_state": "observed",
      "verification_rule_id": null,
      "verification_scope": "Canonical first-party creative-entity definition."
    },
    {
      "claim_id": "CLAIM-005",
      "entity_id": "OZCU-001",
      "claim_type": "canonical_definition",
      "claim": "OZCU is the company/venture brand behind the digital marketing and optimization project for artists.",
      "source": "OZCU canonical entity passport",
      "source_ref": "entity/ENTITY-PASSPORT-OZCU.md",
      "evidence_refs": [
        "ENTITY-MASTER-RECORD.md",
        "entity-graph.json"
      ],
      "date": "2026-09-25",
      "claim_status": "active",
      "evidence_state": "observed",
      "verification_rule_id": null,
      "verification_scope": "First-party definition of the venture brand; does not assert legal incorporation or independent market validation."
    },
    {
      "claim_id": "CLAIM-006",
      "entity_id": "MC-001",
      "claim_type": "canonical_definition",
      "claim": "Marii Cuadros is CEO of OZCU.",
      "source": "OZCU canonical entity passport",
      "source_ref": "entity/ENTITY-PASSPORT-OZCU.md",
      "evidence_refs": [
        "entity/ENTITY-PASSPORT-MARII-CUADROS.md",
        "entity-graph.json"
      ],
      "date": "2026-09-25",
      "claim_status": "active",
      "evidence_state": "observed",
      "verification_rule_id": null,
      "verification_scope": "First-party role statement recorded by the venture; not independent corporate registry verification."
    },
    {
      "claim_id": "CLAIM-007",
      "entity_id": "AIO-001",
      "claim_type": "canonical_definition",
      "claim": "AIO CODE is a research and implementation methodology developed by Marii Cuadros and applied by OZCU.",
      "source": "AIO CODE canonical entity passport",
      "source_ref": "entity/ENTITY-PASSPORT-AIO-CODE.md",
      "evidence_refs": [
        "ENTITY-MASTER-RECORD.md",
        "entity-graph.json"
      ],
      "date": "2026-09-25",
      "claim_status": "active",
      "evidence_state": "observed",
      "verification_rule_id": null,
      "verification_scope": "First-party methodology definition and relationship; not independent evidence of external recognition or effectiveness."
    },
    {
      "claim_id": "CLAIM-008",
      "entity_id": "VOID-001",
      "claim_type": "canonical_definition",
      "claim": "VOID MODE is a creative system for artists developed by Marii Cuadros and applied by OZCU.",
      "source": "VOID MODE canonical entity passport",
      "source_ref": "entity/ENTITY-PASSPORT-VOID-MODE.md",
      "evidence_refs": [
        "ENTITY-MASTER-RECORD.md",
        "entity-graph.json"
      ],
      "date": "2026-09-25",
      "claim_status": "superseded",
      "evidence_state": "observed",
      "verification_rule_id": null,
      "verification_scope": "First-party definition and relationship; not a demonstrated commercial outcome."
    },
    {
      "claim_id": "CLAIM-009",
      "entity_id": "VOID-001",
      "claim_type": "canonical_definition",
      "claim": "VOID MODE is the artist’s visual and expressive ecosystem within AIO CODE, developed by Marii Cuadros, encompassing music, video production, wardrobe, playlists, YouTube and the artist’s visual world without a single-category restriction.",
      "source": "VOID MODE canonical entity passport",
      "source_ref": "entity/ENTITY-PASSPORT-VOID-MODE.md",
      "evidence_refs": [
        "ENTITY-MASTER-RECORD.md",
        "entity-graph.json",
        "brain/AIO-CODE-BRAIN-v1.md"
      ],
      "date": "2026-09-27",
      "claim_status": "active",
      "evidence_state": "observed",
      "verification_rule_id": null,
      "verification_scope": "First-party creator definition; not independent validation, legal incorporation, demonstrated replicability or a commercial result."
    }
  ],
  "integrity_rules": [
    "claim_status and evidence_state are separate dimensions and must never be collapsed.",
    "A canonical definition is not automatically independent external validation.",
    "Every claim must identify its canonical entity and trace to source/evidence references.",
    "Promotion to verified requires a declared verification rule, scope, verifier, date and evidence references.",
    "Research findings must remain traceable to observations, measurements and experiments where applicable."
  ],
  "governing_standard": "EVIDENCE-STANDARD-v1.md"
}
